{
  "schema": 1,
  "ok": false,
  "command": "doctor",
  "status": "unhealthy",
  "value": [
    {
      "check": "peer-rspack",
      "status": "pass",
      "detail": "every direct dependency with an @rspack/core peer range accepts the engine's 2.2.3"
    },
    {
      "check": "ready-contract",
      "status": "fail",
      "detail": "no ready contract at /home/dev/my-extension/dist/extension-js/chromium/ready.json",
      "remediation": "Start a dev session first: extension dev --browser=chromium --allow-control (add --allow-eval for the eval verb)"
    },
    {
      "check": "server-process",
      "status": "skip",
      "detail": "skipped: blocked by ready-contract"
    },
    {
      "check": "port-agreement",
      "status": "skip",
      "detail": "skipped: blocked by ready-contract"
    },
    {
      "check": "control-channel",
      "status": "skip",
      "detail": "skipped: blocked by ready-contract"
    },
    {
      "check": "eval-token",
      "status": "skip",
      "detail": "skipped: blocked by ready-contract"
    },
    {
      "check": "executor",
      "status": "skip",
      "detail": "skipped: blocked by ready-contract"
    },
    {
      "check": "browser",
      "status": "skip",
      "detail": "skipped: blocked by ready-contract"
    }
  ],
  "error": {
    "code": "E_SESSION_NOT_FOUND",
    "message": "1 of 8 doctor checks failed."
  },
  "hint": "Start a dev session first: extension dev --browser=chromium --allow-control (add --allow-eval for the eval verb)",
  "browser": "chromium",
  "warnings": []
}
